{
  "$schema": "https://json-schema.org/draft/2020-12/schema",
  "$id": "https://traceknot.kyungho.info/schemas/observation.v1.json",
  "title": "Canonical verification observation",
  "type": "object",
  "additionalProperties": false,
  "required": ["schemaVersion", "observationId", "requestId", "snapshotId", "producer", "execution", "artifacts"],
  "properties": {
    "schemaVersion": { "const": "observation/v1" },
    "observationId": { "type": "string", "minLength": 1 },
    "requestId": { "type": "string", "minLength": 1 },
    "snapshotId": { "type": "string", "minLength": 1 },
    "producer": {
      "type": "object",
      "additionalProperties": false,
      "required": ["kind", "identity", "independence"],
      "properties": {
        "kind": { "enum": ["self", "harness-managed", "deterministic-verifier", "ci", "human", "external-system"] },
        "identity": { "type": "string", "minLength": 1 },
        "independence": { "enum": ["self-check", "separate-verification-context", "independent-producer", "external-approval"] }
      }
    },
    "execution": {
      "type": "object",
      "additionalProperties": false,
      "required": ["kind", "identity", "startedAt", "finishedAt", "exitStatus"],
      "properties": {
        "kind": { "enum": ["command", "browser", "review", "experiment", "approval"] },
        "identity": { "type": "string", "minLength": 1 },
        "startedAt": { "type": "string", "pattern": "^\\d{4}-\\d{2}-\\d{2}T\\d{2}:\\d{2}:\\d{2}(?:\\.\\d+)?Z$" },
        "finishedAt": { "type": "string", "pattern": "^\\d{4}-\\d{2}-\\d{2}T\\d{2}:\\d{2}:\\d{2}(?:\\.\\d+)?Z$" },
        "exitStatus": { "enum": ["passed", "failed", "blocked", "cancelled", "timed-out"] },
        "exitCode": { "type": "integer" }
      }
    },
    "artifacts": {
      "type": "array",
      "items": {
        "type": "object",
        "additionalProperties": false,
        "required": ["type", "digest"],
        "properties": {
          "type": { "type": "string", "minLength": 1 },
          "digest": { "type": "string", "pattern": "^[a-f0-9]{64}$" },
          "path": { "type": "string", "minLength": 1 }
        }
      }
    },
    "actualValues": {
      "type": "array",
      "uniqueItems": true,
      "items": {
        "type": "object",
        "additionalProperties": false,
        "required": ["field", "value"],
        "properties": {
          "field": { "type": "string", "minLength": 1 },
          "value": { "type": ["string", "number", "boolean", "null"] }
        }
      }
    }
  },
  "allOf": [
    {
      "if": {
        "type": "object",
        "properties": {
          "producer": {
            "type": "object",
            "properties": {
              "kind": { "const": "self" }
            },
            "required": ["kind"]
          }
        },
        "required": ["producer"]
      },
      "then": {
        "type": "object",
        "properties": {
          "producer": {
            "type": "object",
            "properties": {
              "independence": { "const": "self-check" }
            }
          }
        }
      }
    }
  ]
}
